{
  "task_summary": "Refactor flatten and flatten_legacy in solution.py to delegate their shared algorithm to one private helper, preserve their compatibility and behavior requirements, and add public API tests in test_solution.py.",
  "constraints": [
    "Work only in the supplied task workspace.",
    "Use Python 3.11+ and the standard library; do not access parent repositories or external services.",
    "Preserve both function signatures, return types, error behavior, input immutability, imports, public names, and type hints.",
    "Flatten exactly one list level in order, ignore empty inner lists, and return a new list without modifying inner lists.",
    "Do not mutate input collections; no algorithmic complexity constraint is imposed.",
    "test_solution.py must contain at least two passing unittest test methods exercising the public API."
  ],
  "success_criteria": [
    {
      "id": "SC-1",
      "description": "solution.py contains definitions for both public functions and one private helper.",
      "check": {
        "type": "regex",
        "path": "solution.py",
        "pattern": "(?s)def flatten\\b.*?def flatten_legacy\\b.*?def _[A-Za-z_]\\w*\\b"
      }
    },
    {
      "id": "SC-2",
      "description": "The public tests file exists.",
      "check": {
        "type": "file_exists",
        "path": "test_solution.py"
      }
    },
    {
      "id": "SC-3",
      "description": "The public tests file defines at least two unittest test methods.",
      "check": {
        "type": "regex",
        "path": "test_solution.py",
        "pattern": "(?s)def test_[A-Za-z_]\\w*\\s*\\(self[^)]*\\):.*?def test_[A-Za-z_]\\w*\\s*\\(self[^)]*\\):"
      }
    },
    {
      "id": "SC-4",
      "description": "The unittest discovery command completes successfully.",
      "check": {
        "type": "command",
        "command": "python -m unittest discover -v",
        "expected": {
          "exit_code": 0
        }
      }
    }
  ],
  "verification": [
    {
      "command": "python -m unittest discover -v",
      "expected": {
        "exit_code": 0
      }
    }
  ],
  "stop_conditions": [],
  "assumptions": [
    "The supplied workspace root is the relative path base, and the requested files are solution.py and test_solution.py at that root; either file may not exist yet and may be created.",
    "Preserved signatures, return types, error behavior, import compatibility, public names, and type hints will be judged against the supplied workspace's existing declarations and behavior. These specifics are not fully included in the request.",
    "Unittest discovery from the workspace root finds test_solution.py and executes its test methods; the request's stated command is used as supplied."
  ],
  "reasoning_effort": {
    "value": "xhigh",
    "rationale": "effort-v1: utf8_byte_bound=866; distinct_files=2; tests_requested=true; requirement_segments=17; score=6"
  },
  "cost_estimate": {
    "input_tokens": 17402,
    "output_tokens": 520,
    "usd": 0.00065236
  }
}
