{
  "task_summary": "Implement merge in solution.py and add standard-library unittest coverage in test_solution.py for ordinary, boundary, and empty inputs, preserving the stated public behavior and compatibility requirements.",
  "constraints": [
    "Work only in the supplied task workspace.",
    "Use Python 3.11+ and the standard library.",
    "Do not access parent repositories or external services.",
    "Do not mutate either input collection.",
    "Maintain type hints.",
    "There is no algorithmic complexity constraint.",
    "Retain all stated behavior and compatibility requirements."
  ],
  "success_criteria": [
    {
      "id": "SC-1",
      "description": "solution.py compiles successfully.",
      "check": {
        "type": "command",
        "command": "python -m py_compile solution.py",
        "expected": {
          "exit_code": 0
        }
      }
    },
    {
      "id": "SC-2",
      "description": "solution.py contains a type-hinted definition for the public merge function.",
      "check": {
        "type": "regex",
        "path": "solution.py",
        "pattern": "(?m)^\\s*def\\s+merge\\s*\\([^\\n]*\\)\\s*->\\s*[^:]+:"
      }
    },
    {
      "id": "SC-3",
      "description": "test_solution.py contains at least two unittest test methods that exercise the public API.",
      "check": {
        "type": "command",
        "command": "python -c 'import ast; from pathlib import Path; tree = ast.parse(Path(\"test_solution.py\").read_text()); methods = [n for c in ast.walk(tree) if isinstance(c, ast.ClassDef) for n in c.body if isinstance(n, ast.FunctionDef) and n.name.startswith(\"test_\")]; assert len(methods) >= 2; assert any(isinstance(n, ast.Call) and isinstance(n.func, ast.Name) and n.func.id == \"merge\" for m in methods for n in ast.walk(m))'",
        "expected": {
          "exit_code": 0
        }
      }
    },
    {
      "id": "SC-4",
      "description": "The public behavior is implemented and represented by tests: return the union of keys, add values for shared keys, preserve zero and negative totals, leave both inputs unchanged, and cover ordinary, boundary, and empty inputs.",
      "check": {
        "type": "llm_judge",
        "rubric": "Read solution.py and test_solution.py. Determine whether the implementation and tests together express the requested behavior: the result includes keys from both inputs, shared-key values are added, zero and negative totals are preserved, and neither input is mutated. Confirm test coverage includes ordinary, boundary, and empty inputs. Do not infer or require unspecified APIs beyond the named public merge function."
      }
    },
    {
      "id": "SC-5",
      "description": "The requested unittest discovery command completes successfully.",
      "check": {
        "type": "command",
        "command": "python -m unittest discover -v",
        "expected": {
          "exit_code": 0
        }
      }
    }
  ],
  "verification": [
    {
      "command": "python -m py_compile solution.py",
      "expected": {
        "exit_code": 0
      }
    },
    {
      "command": "python -c 'import ast; from pathlib import Path; tree = ast.parse(Path(\"test_solution.py\").read_text()); methods = [n for c in ast.walk(tree) if isinstance(c, ast.ClassDef) for n in c.body if isinstance(n, ast.FunctionDef) and n.name.startswith(\"test_\")]; assert len(methods) >= 2; assert any(isinstance(n, ast.Call) and isinstance(n.func, ast.Name) and n.func.id == \"merge\" for m in methods for n in ast.walk(m))'",
      "expected": {
        "exit_code": 0
      }
    },
    {
      "command": "python -m unittest discover -v",
      "expected": {
        "exit_code": 0
      }
    }
  ],
  "stop_conditions": [],
  "assumptions": [
    "The named files are relative to the supplied task workspace; solution.py and test_solution.py may not exist yet and may be created.",
    "The public API is a function named merge in solution.py; its precise signature and input collection types are unspecified, so implementation must choose compatible type hints without adding unstated requirements.",
    "The unittest suite is discoverable by the requested command python -m unittest discover -v."
  ],
  "reasoning_effort": {
    "value": "xhigh",
    "rationale": "effort-v1: utf8_byte_bound=828; distinct_files=2; tests_requested=true; requirement_segments=15; score=6"
  },
  "cost_estimate": {
    "input_tokens": 17392,
    "output_tokens": 804,
    "usd": 0.00079336
  }
}
